{"type":"config","name":"Speed up Test CI job on GitHub-hosted runners","metricName":"ci_test_seconds","metricUnit":"s","bestDirection":"lower"}
{"run":1,"commit":"a4fac3f","metric":847,"metrics":{"packages_coverage_seconds":668,"examples_seconds":114,"startup_seconds":59,"ci_run_id":32468842242},"status":"keep","description":"Baseline hosted-CI Test job on current main with CI maxWorkers at 50%","timestamp":1787306108587,"segment":0,"confidence":null,"asi":{"hypothesis":"Establish a fresh hosted-runner baseline for the complete Test job before changing worker concurrency.","historical_context":"The 847s baseline is within the predecessor PR's 723-854s range; package coverage remains dominant at 668s."}}
{"run":2,"commit":"41b37c3","metric":787,"metrics":{"packages_coverage_seconds":607,"examples_seconds":114,"startup_seconds":60,"ci_run_id":32470205923},"status":"keep","description":"Raise CI Vitest workers from 50% to 75%, leaving one hosted-runner core free","timestamp":1787307106027,"segment":0,"confidence":null,"asi":{"hypothesis":"Using three of four hosted-runner cores should shorten the dominant coverage phase while preserving one core for Postgres and orchestration.","result":"The complete Test job improved by 60s (7.1%); the package coverage phase improved by 61s while examples and startup were unchanged. No instability appeared in this run.","next_action_hint":"Test 100% workers to find whether the fourth worker helps or recreates oversubscription."}}
{"run":3,"commit":"e832d00","metric":794,"metrics":{"packages_coverage_seconds":604,"examples_seconds":115,"startup_seconds":69,"ci_run_id":32471525771},"status":"discard","description":"Use all four hosted-runner cores for CI Vitest workers","timestamp":1787307984401,"segment":0,"confidence":8.571428571428571,"asi":{"hypothesis":"A fourth Vitest worker might further reduce the package coverage phase.","result":"Coverage was only 3s faster than 75%, while startup rose 9s and the complete job regressed 7s. The fourth worker provides no primary-metric benefit and removes resource headroom.","rollback_reason":"Primary metric regressed from the 787s best to 794s and full concurrency has higher stability risk.","next_action_hint":"Restore 75%; inspect CI logs for per-project durations or test independent phase overlap."}}
{"run":4,"commit":"d60d500","metric":790,"metrics":{"packages_coverage_seconds":613,"examples_seconds":114,"startup_seconds":57,"ci_run_id":32472735070},"status":"discard","description":"Run CI Vitest projects in worker threads at the winning 75% concurrency","timestamp":1787308914829,"segment":0,"confidence":17.142857142857142,"asi":{"hypothesis":"Threads could reduce process startup and module-transfer overhead across 1,164 test files while retaining isolation.","result":"The suite passed, but the complete job was 3s slower and coverage 6s slower than the 75%-fork run; thread startup savings did not offset execution cost.","rollback_reason":"No primary metric improvement over 75% with the default fork pool.","next_action_hint":"Restore 75% forks; test overlap of independent package coverage and example workloads or inspect typecheck/import dominance."}}
{"run":5,"commit":"008d681","metric":703,"metrics":{"packages_coverage_seconds":638,"examples_seconds":191,"startup_seconds":59,"ci_run_id":32473956663},"status":"keep","description":"Run package coverage and example tests concurrently inside the Test job","timestamp":1787309794515,"segment":0,"confidence":36,"asi":{"hypothesis":"Overlapping the independent package-coverage and example-test commands should reduce wall time despite CPU contention, while preserving one Test job and all pass/fail guarantees.","result":"The full job improved from 787s to 703s (10.7%). Contention slowed coverage from 607s to 638s and examples from 114s to 191s, but 191s of overlap more than compensated. Both workloads and coverage reporting passed.","correctness":"The shell waits for both PIDs, preserves either exit status, emits phase timing, and the existing coverage report still runs under !cancelled(). The workflow contract test was updated and passes.","next_action_hint":"Try 50% coverage workers during overlap to reduce contention, or confirm the 703s result before increasing complexity."}}
{"run":6,"commit":"864dcda","metric":748,"metrics":{"packages_coverage_seconds":668,"examples_seconds":242,"startup_seconds":75,"ci_run_id":32474948672},"status":"discard","description":"Reserve two hosted-runner cores for example tests during workload overlap","timestamp":1787310627479,"segment":0,"confidence":6.260869565217392,"asi":{"hypothesis":"Reducing package Vitest from three to two workers during overlap might lessen contention enough to shorten the combined critical path.","result":"Both workloads slowed: coverage rose to 668s and examples to 242s, producing a 748s job, 45s worse than 75% overlap.","rollback_reason":"Primary metric regressed 6.4%; reserving an extra core did not improve effective throughput.","next_action_hint":"Restore 75% overlap. Try 100% overlap only as a boundary check, though prior serial 100% had no benefit."}}
{"run":7,"commit":"6675116","metric":548,"metrics":{"packages_coverage_seconds":475,"examples_seconds":196,"startup_seconds":66,"ci_run_id":32476018995},"status":"keep","description":"Use full CI Vitest concurrency while package coverage overlaps example tests","timestamp":1787311274030,"segment":0,"confidence":7.666666666666667,"asi":{"hypothesis":"With examples already consuming otherwise idle intervals, allowing Vitest its fourth worker may increase total throughput despite oversubscription.","result":"The job dropped from 703s to 548s (22.0%); coverage fell from 638s to 475s while examples stayed near 196s. All 1,164 package files, examples, coverage report, and clean-tree check passed.","risk":"This is unexpectedly much better than both 75%-overlap and serial 100%. Full concurrency previously carried Postgres/PGlite instability risk, so repeat before trusting.","next_action_hint":"Repeat the identical 100%-overlap configuration to test stability and timing reproducibility."}}
{"run":8,"commit":"6bc719f","metric":739,"metrics":{"packages_coverage_seconds":663,"examples_seconds":248,"startup_seconds":69,"ci_run_id":32476845242},"status":"discard","description":"Repeat full-concurrency overlap configuration for reproducibility","timestamp":1787312103481,"segment":0,"confidence":10.872727272727273,"asi":{"hypothesis":"An unchanged rerun would confirm the 548s result and full-concurrency stability.","result":"The rerun passed but took 739s; coverage varied from 475s to 663s and examples from 196s to 248s. Hosted-runner variance is much larger than expected, so the 548s point is not representative by itself.","rollback_reason":"The repeated measurement regressed 191s versus the prior point; no code delta exists to retain or revert.","next_action_hint":"Run another unchanged 100%-overlap sample, then compare a small sample distribution against repeated 75%-overlap rather than single minima."}}
{"run":9,"commit":"f970536","metric":735,"metrics":{"packages_coverage_seconds":663,"examples_seconds":246,"startup_seconds":65,"ci_run_id":32477882654},"status":"discard","description":"Third full-concurrency overlap measurement","timestamp":1787312922740,"segment":0,"confidence":7.119047619047619,"asi":{"hypothesis":"A third sample would distinguish the 548s outlier from typical 100%-overlap performance.","result":"The job passed at 735s, nearly matching the 739s repeat. Typical full-concurrency overlap is therefore about 737s; the 548s run was a favorable hosted-runner outlier.","rollback_reason":"No code delta; this repeated point is worse than both the retained minimum and the sole 75%-overlap sample.","next_action_hint":"Switch back to 75%-overlap and collect two more samples for a fair median comparison."}}
{"run":10,"commit":"fe0ea57","metric":736,"metrics":{"packages_coverage_seconds":661,"examples_seconds":195,"startup_seconds":68,"ci_run_id":32478951542},"status":"discard","description":"Return to 75%-worker overlap for a second sample","timestamp":1787313751851,"segment":0,"confidence":7.119047619047619,"asi":{"hypothesis":"Leaving one core free should make overlap faster and steadier than full Vitest concurrency.","result":"The second 75% sample passed at 736s versus its first 703s sample. Coverage was 661s and examples 195s. This is effectively tied with the two typical 100% samples at 735s and 739s.","rollback_reason":"The 736s primary metric did not improve the retained best; the tool cannot meaningfully revert already-pushed measurement commits.","next_action_hint":"Collect a third 75% sample; choose based on medians and stability, not the 548s outlier."}}
{"run":11,"commit":"9fca75b","metric":571,"metrics":{"packages_coverage_seconds":510,"examples_seconds":155,"startup_seconds":56,"ci_run_id":32480009364},"status":"discard","description":"Third 75%-worker overlap measurement","timestamp":1787314407118,"segment":0,"confidence":6.229166666666667,"asi":{"hypothesis":"A third 75% sample would establish a robust median for selecting worker concurrency.","result":"The run passed at 571s. Three 75% samples are 571/703/736 (median 703s); three 100% samples are 548/735/739 (median 735s). Choose 75% based on the 32s lower median and resource headroom.","rollback_reason":"This sample does not beat the absolute 548s hosted-runner outlier, though it establishes 75% as the better median configuration.","next_action_hint":"Keep 75% conceptually and cap concurrent example Turbo task concurrency; examples finish far before coverage, so trading example speed for less coverage contention may reduce the critical path."}}
{"run":12,"commit":"16bb937","metric":674,"metrics":{"packages_coverage_seconds":599,"examples_seconds":333,"startup_seconds":71,"ci_run_id":32480893962},"status":"discard","description":"Limit overlapping example Turbo tasks to one at a time","timestamp":1787315161828,"segment":0,"confidence":5.862745098039215,"asi":{"hypothesis":"Serializing example workspace tasks would free CPU for the coverage critical path while examples still finish before coverage.","result":"The job passed at 674s; examples expanded to 333s but still completed 266s before coverage at 599s. This is 29s below the uncapped 75%-overlap median, but one sample cannot resolve runner noise.","rollback_reason":"The single 674s point does not beat the retained absolute best and requires comparison with a moderate example concurrency.","next_action_hint":"Try --concurrency=2, which may reduce examples oversubscription without serializing all workspace tasks."}}
{"run":13,"commit":"ef0c2a3","metric":763,"metrics":{"packages_coverage_seconds":686,"examples_seconds":246,"startup_seconds":70,"ci_run_id":32481888160},"status":"discard","description":"Limit overlapping example Turbo tasks to two at a time","timestamp":1787316006633,"segment":0,"confidence":6.229166666666667,"asi":{"hypothesis":"Two concurrent example workspace tasks could balance example completion against package-coverage CPU needs.","result":"The job passed but took 763s; coverage was the slowest overlap sample at 686s while examples took 246s. Moderate Turbo concurrency did not produce a useful balance.","rollback_reason":"Primary metric regressed 89s versus example concurrency 1 and 60s versus uncapped 75%-overlap median.","next_action_hint":"Return to concurrency 1 for another sample, or test whether deferring examples until late in coverage can reduce peak contention."}}
{"run":14,"commit":"98b6eec","metric":0,"metrics":{"packages_coverage_seconds":555,"examples_seconds":245,"startup_seconds":0,"ci_run_id":32483003057},"status":"crash","description":"Repeat single-example-task overlap configuration","timestamp":1787316745232,"segment":0,"confidence":6.229166666666667,"asi":{"hypothesis":"A second concurrency-1 sample would confirm its apparent lower overlap median.","result":"The Test job failed: postgres-codec-testkit aggregate defaults lost its database connection (`read ECONNRESET`, then `Client has encountered a connection error and is not queryable`), causing 7 failures. Examples completed in 245s; package coverage failed after 555s.","error_details":"Hosted-run log also showed react-router Postgres pool connection terminations. This matches the resource-starvation failure mode documented by the original 50% worker cap.","rollback_reason":"Parallel package coverage and example tests introduce unacceptable Postgres flakiness even at 75% package workers and example concurrency 1.","next_action_hint":"Abandon workload overlap, restore serial examples, retain 75% package workers, and collect repeated serial 75% measurements."}}
{"run":15,"commit":"8ff22aa","metric":773,"metrics":{"packages_coverage_seconds":585,"examples_seconds":111,"startup_seconds":69,"ci_run_id":32484027897},"status":"keep","description":"Restore serial workloads and retain 75% package Vitest workers after overlap flake","timestamp":1787317628269,"segment":0,"confidence":7.119047619047619,"asi":{"hypothesis":"Serializing examples again removes database contention while three Vitest workers preserve the safe package-coverage speedup.","result":"The full Test job passed in 773s, 74s (8.7%) below the 847s baseline. Package coverage took 585s versus baseline 668s; examples returned to 111s.","correctness":"This removes the overlap configuration that produced ECONNRESET and returns to the established step-level failure semantics.","next_action_hint":"Repeat serial 75% once more for stability, then investigate coverage-specific settings that do not add concurrent database load."}}
{"run":16,"commit":"f30dbd2","metric":0,"metrics":{"packages_coverage_seconds":599,"examples_seconds":112,"startup_seconds":65,"ci_run_id":32485225250},"status":"crash","description":"Repeat serial 75%-worker configuration for stability","timestamp":1787318531654,"segment":0,"confidence":7.119047619047619,"asi":{"hypothesis":"A repeated serial 75% run would confirm the worker-count speedup without the overlap flake.","result":"All 1,164 files and 15,364 tests passed, but Vitest failed the phase because language-server/server.test.ts produced an unhandled `Connection is disposed` rejection after its final test. Coverage reporting and examples still passed.","error_details":"Unlike the overlap failure, this was not a Postgres connection loss. It is an asynchronous language-server teardown race and may be an existing suite flake, but increased file concurrency could increase its likelihood.","rollback_reason":"A speedup that raises CI flake risk is not acceptable without distinguishing or fixing the teardown race.","next_action_hint":"Test isolate:false at the safe 50% worker cap, using Vitest's own report that 998 worker spawns cost at least ~43.75s; shared-state failures will reveal whether it is viable."}}
{"run":17,"commit":"dea3311","metric":815,"metrics":{"packages_coverage_seconds":641,"examples_seconds":109,"startup_seconds":60,"ci_run_id":32486508106},"status":"keep","description":"Reuse CI Vitest workers across files at the safe 50% concurrency cap","timestamp":1787319442925,"segment":0,"confidence":7.119047619047619,"asi":{"hypothesis":"Disabling per-file worker isolation should eliminate most of the 998 worker spawns Vitest reported while retaining the stable two-worker resource cap.","result":"The complete job passed in 815s, 32s below baseline; package coverage improved from 668s to 641s. All tests, type tests, coverage thresholds/reporting, examples, and clean-tree checks passed.","risk":"Worker reuse can expose shared module/process state between files, so repeated runs are required even though this run was clean.","next_action_hint":"Repeat isolate:false at 50% to test stability and timing."}}
{"run":18,"commit":"7817d7a","metric":836,"metrics":{"packages_coverage_seconds":661,"examples_seconds":112,"startup_seconds":57,"ci_run_id":32487830559},"status":"discard","description":"Repeat 50%-worker reuse configuration","timestamp":1787320362900,"segment":0,"confidence":8.191780821917808,"asi":{"hypothesis":"A second isolate:false run at 50% would confirm the spawn-overhead improvement without shared-state failures.","result":"The run passed in 836s. Two samples are 815s and 836s (median 825.5s), only 21.5s below the 847s baseline and within broader hosted-runner variability.","rollback_reason":"The repeated point did not improve the retained 815s result; the small apparent gain does not yet justify global loss of file isolation.","next_action_hint":"Try isolate:false with 75% workers to see whether reuse also prevents the language-server teardown race while retaining higher throughput."}}
{"run":19,"commit":"3263f08","metric":802,"metrics":{"packages_coverage_seconds":613,"examples_seconds":116,"startup_seconds":67,"ci_run_id":32489173159},"status":"keep","description":"Combine three CI workers with cross-file worker reuse","timestamp":1787321250384,"segment":0,"confidence":9.64516129032258,"asi":{"hypothesis":"Worker reuse at 75% could preserve higher throughput and avoid the prior per-file teardown rejection.","result":"The job passed in 802s, 45s below baseline and 13s below the best 50%-reuse sample. Coverage took 613s. No language-server or database error occurred.","risk":"Global isolate:false remains a semantic tradeoff and this timing is slower than successful isolate:true 75% samples.","next_action_hint":"Repeat for stability; discard isolate:false if it does not demonstrate a clear repeatable advantage over simpler 75% isolation."}}
{"run":20,"commit":"31196fa","metric":781,"metrics":{"packages_coverage_seconds":603,"examples_seconds":114,"startup_seconds":59,"ci_run_id":32490455956},"status":"keep","description":"Repeat three-worker CI with cross-file worker reuse","timestamp":1787322107513,"segment":0,"confidence":9.2,"asi":{"hypothesis":"A second 75%-reuse run would show whether the configuration is stable and repeatably faster than baseline.","result":"The job passed in 781s. Two samples are 802s and 781s (median 791.5s), with package coverage at 613s and 603s. No unhandled rejection or database loss occurred.","tradeoff":"The median is ~55s below baseline but only modestly different from 75% with isolation, while shared process state is a broader semantic change.","next_action_hint":"Investigate targeted isolate:false only for packages without stateful/database tests, or retain isolation and optimize worker spawning another way."}}
{"run":21,"commit":"5d856e2","metric":742,"metrics":{"packages_coverage_seconds":552,"examples_seconds":113,"startup_seconds":71,"ci_run_id":32491971312},"status":"keep","description":"Drop redundant text coverage reporter at the safe 50% worker cap","timestamp":1787323078051,"segment":0,"confidence":10.678571428571429,"asi":{"hypothesis":"The custom JSON coverage gate makes Vitest's huge text table redundant; emitting only JSON should reduce report generation/log transport while restoring safe isolation and worker count.","result":"The complete job passed in 742s, 105s below baseline; package coverage took 552s. The magnitude exceeds expected reporter savings and likely includes favorable runner variance.","correctness":"Coverage JSON was generated, the custom per-package report passed, examples passed, and file isolation plus the original 50% resource cap were restored.","next_action_hint":"Repeat unchanged to estimate the true reporter-only gain."}}
{"run":22,"commit":"1d7d53c","metric":945,"metrics":{"packages_coverage_seconds":751,"examples_seconds":127,"startup_seconds":61,"ci_run_id":32493202956},"status":"discard","description":"Repeat JSON-only coverage reporter configuration","timestamp":1787324087263,"segment":0,"confidence":9.2,"asi":{"hypothesis":"A repeat would show a small consistent gain from avoiding text coverage rendering/logging.","result":"The unchanged run passed but took 945s, with coverage at 751s. Together with 742s, this confirms extreme hosted-runner variance and does not quantify a meaningful reporter-only speedup.","rollback_reason":"The repeated primary metric is 98s worse than baseline; no code delta exists in this measurement commit.","next_action_hint":"Retain JSON-only only if simplification is independently worthwhile; pursue structural savings with less sensitivity to runner speed."}}
{"run":23,"commit":"37f1ad0","metric":864,"metrics":{"packages_coverage_seconds":635,"examples_seconds":144,"startup_seconds":78,"ci_run_id":32494774140},"status":"discard","description":"Use VM-isolated fork workers at the safe 50% concurrency cap","timestamp":1787325084988,"segment":0,"confidence":8.08108108108108,"asi":{"hypothesis":"vmForks could reuse child processes while creating an isolated VM context per file, avoiding global shared state and most fork startup cost.","result":"All tests passed, but the complete job took 864s. Coverage was 635s; startup and examples were also slower than typical. No clear primary benefit appeared.","rollback_reason":"Primary metric regressed 17s versus baseline and 122s versus the best JSON-only safe run.","next_action_hint":"Try vmThreads only if cross-realm/native compatibility is acceptable; otherwise remove VM pooling and focus on CI step structure or coverage output."}}
