{"run":24,"commit":"20443e3","metric":819,"metrics":{"packages_coverage_seconds":641,"examples_seconds":113,"startup_seconds":58,"ci_run_id":32496300021},"status":"discard","description":"Use VM-isolated thread workers at the safe 50% concurrency cap","timestamp":1787326005771,"segment":0,"confidence":7.569620253164557,"asi":{"hypothesis":"vmThreads should preserve per-file isolation while avoiding per-file process spawn overhead more efficiently than vmForks.","result":"The complete job passed in 819s, 45s faster than vmForks and 28s below baseline. Coverage took 641s. No cross-realm or native/WASM failure appeared.","rollback_reason":"The single result did not beat the retained safe JSON-only minimum and is close to normal runner variation.","next_action_hint":"Repeat unchanged to test vmThreads stability and estimate its median."}}
{"run":25,"commit":"f867c64","metric":814,"metrics":{"packages_coverage_seconds":640,"examples_seconds":109,"startup_seconds":60,"ci_run_id":32497656915},"status":"keep","description":"Repeat VM-isolated thread workers at 50% CI concurrency","timestamp":1787326899628,"segment":0,"confidence":7.666666666666667,"asi":{"hypothesis":"A second vmThreads run would confirm stable isolated worker reuse.","result":"The job passed again in 814s, nearly identical to 819s; coverage was 640s versus 641s. The 816.5s median is 30.5s below baseline and materially steadier than default-fork hosted samples.","correctness":"vmThreads creates a fresh VM context per file, so file-level module/global isolation remains. Supabase explicitly overrides the root pool to forks for its WASM/mock requirements.","risk":"VM realms can change instanceof identity and memory behavior; two complete passes found no incompatibility, but a third pass is prudent.","next_action_hint":"Run a third vmThreads sample, then consider vmMemoryLimit or 75% vmThreads if stability remains clean."}}
{"run":26,"commit":"8bd6d71","metric":811,"metrics":{"packages_coverage_seconds":636,"examples_seconds":112,"startup_seconds":58,"ci_run_id":32499005740},"status":"keep","description":"Third VM-thread isolation stability run","timestamp":1787327787502,"segment":0,"confidence":7.666666666666667,"asi":{"hypothesis":"A third vmThreads pass would rule out immediate cross-realm, memory, and flake concerns.","result":"The third run passed in 811s with coverage at 636s. Three samples are 819/814/811 (median 814s, 8s range), the most stable candidate distribution in the session.","correctness":"All 1,164 files, 15,364 tests, type tests, JSON coverage collection, custom thresholds, examples, and clean-tree checks passed for a third time.","next_action_hint":"Test vmThreads at 75% workers; the VM pool may avoid process oversubscription while using the third core."}}
{"run":27,"commit":"16f966c","metric":753,"metrics":{"packages_coverage_seconds":581,"examples_seconds":109,"startup_seconds":58,"ci_run_id":32500335101},"status":"keep","description":"Run VM-isolated CI tests with three workers","timestamp":1787328630035,"segment":0,"confidence":7.868421052631579,"asi":{"hypothesis":"A third VM-thread worker can improve throughput without the fork/process pressure that motivated the original 50% cap.","result":"The full job passed in 753s, 58s faster than the best 50%-vmThreads sample and 94s below baseline. Coverage took 581s; examples and startup were unchanged.","risk":"Higher concurrency previously exposed a language-server teardown race under fork isolation, so vmThreads 75% needs repeated stability proof.","next_action_hint":"Repeat 75%-vmThreads at least twice; reject on any unhandled rejection, database loss, or memory failure."}}
{"run":28,"commit":"54687b8","metric":767,"metrics":{"packages_coverage_seconds":588,"examples_seconds":109,"startup_seconds":64,"ci_run_id":32501576368},"status":"discard","description":"Second three-worker VM-thread stability run","timestamp":1787329477381,"segment":0,"confidence":7.973333333333334,"asi":{"hypothesis":"The 75%-vmThreads configuration would repeat without the fork-pool teardown/resource failures.","result":"The second run passed in 767s; coverage took 588s. Two samples are 753s and 767s, both substantially below the 814s median at 50% vmThreads.","rollback_reason":"The repeated point is 14s slower than the retained 753s minimum; no code delta exists.","next_action_hint":"Collect a third stability sample before selecting 75%-vmThreads."}}
{"run":29,"commit":"160299b","metric":789,"metrics":{"packages_coverage_seconds":554,"examples_seconds":152,"startup_seconds":77,"ci_run_id":32502789397},"status":"discard","description":"Third three-worker VM-thread stability run","timestamp":1787330345499,"segment":0,"confidence":8.794117647058824,"asi":{"hypothesis":"A third 75%-vmThreads run would complete cleanly and establish a robust distribution.","result":"The third run passed in 789s. Coverage was fastest at 554s, but unrelated startup/examples noise raised total time. Three samples are 753/767/789 (median 767s), all successful.","rollback_reason":"The 789s point did not improve the retained minimum; no code delta exists.","next_action_hint":"75%-vmThreads now has three clean samples. Test 100% vmThreads as a boundary, then choose 75% unless four workers improve repeatably."}}
{"run":30,"commit":"8fb6db3","metric":0,"metrics":{"packages_coverage_seconds":568,"examples_seconds":111,"startup_seconds":58,"ci_run_id":32504039496},"status":"crash","description":"First four-worker VM-thread run; measurement API transient","timestamp":1787331170166,"segment":0,"confidence":8.794117647058824,"asi":{"hypothesis":"Four VM-thread workers might improve coverage without fork-process pressure.","result":"The hosted Test job itself succeeded in 741s (coverage 568s, examples 111s), but measure.sh exited on a transient GitHub Jobs API HTTP 502 before recording metrics.","error_details":"Manual recovery from run 32504039496 confirmed Test success from 16:40:08Z to 16:52:29Z. This is a harness failure, not a candidate failure.","rollback_reason":"Log as crash because run_experiment exited nonzero and emitted no structured primary metric; do not treat the recovered single point as retained evidence.","next_action_hint":"Make measure.sh retry transient gh API failures, then rerun 100%-vmThreads."}}
{"run":31,"commit":"f76df2b","metric":761,"metrics":{"packages_coverage_seconds":583,"examples_seconds":114,"startup_seconds":59,"ci_run_id":32505247674},"status":"discard","description":"Repeat four-worker VM-thread configuration with API retries","timestamp":1787332012002,"segment":0,"confidence":8.305555555555555,"asi":{"hypothesis":"A retried measurement would validate the manually recovered 741s four-worker VM result.","result":"The second Test job passed in 761s; coverage took 583s. Together with the recovered 741s run, 100%-vmThreads is currently ~16s faster in median than 75%-vmThreads.","rollback_reason":"The structured 761s point did not improve the retained 742s minimum; no code delta exists in this measurement commit.","next_action_hint":"Collect a third 100%-vmThreads stability sample before choosing between 100% and 75%."}}
{"run":32,"commit":"768e53b","metric":752,"metrics":{"packages_coverage_seconds":569,"examples_seconds":112,"startup_seconds":64,"ci_run_id":32506470362},"status":"keep","description":"Third four-worker VM-thread stability run","timestamp":1787332843370,"segment":0,"confidence":8.794117647058824,"asi":{"hypothesis":"A third four-worker VM run would establish stable throughput without database or teardown failures.","result":"The third run passed in 752s. Three complete jobs are 741/761/752 (median 752s, 20s range), versus 753/767/789 (median 767s) at 75% and 819/814/811 (median 814s) at 50%.","correctness":"No Postgres, PGlite, language-server, cross-realm, or memory failure occurred across all three 100%-vmThreads jobs.","decision":"Select 100%-vmThreads: it preserves per-file VM isolation, honors Supabase's explicit forks/maxWorkers override, and has the best stable candidate median.","next_action_hint":"Test whether JSON-only coverage output materially contributes by restoring the text reporter under the selected VM configuration for an A/B sample."}}
{"run":33,"commit":"27c3dbd","metric":772,"metrics":{"packages_coverage_seconds":591,"examples_seconds":116,"startup_seconds":59,"ci_run_id":32507749529},"status":"discard","description":"Restore text coverage diagnostics under selected VM-thread configuration","timestamp":1787333745699,"segment":0,"confidence":9.34375,"asi":{"hypothesis":"A/B with the text reporter restored would show whether JSON-only output contributes to the speedup.","result":"The job passed in 772s. Vitest reported 587.58s while the API coverage step was 591s, a 3.42s tail; JSON-only had a 565.39s Vitest duration and 569s API step, a 3.61s tail. Text rendering adds no measurable post-suite cost.","rollback_reason":"The 772s primary point is slower than the selected JSON-only samples, but phase-internal evidence attributes that to runner execution variance, not the text reporter.","decision":"Restore the text reporter to preserve existing diagnostics and keep the final product diff focused on worker pool/concurrency only.","next_action_hint":"Now optimize startup or test execution structurally; do not revisit coverage reporter output."}}
{"run":34,"commit":"c3bf5d2","metric":812,"metrics":{"packages_coverage_seconds":574,"examples_seconds":156,"startup_seconds":65,"ci_run_id":32509068946},"status":"discard","description":"Start Cloudflare example Postgres after package coverage","timestamp":1787334692005,"segment":0,"confidence":8.794117647058824,"asi":{"hypothesis":"Deferring the example-only 5433 Postgres container would keep it from competing with the 9-minute package coverage phase.","result":"The job passed in 812s. Coverage took 574s, essentially the same as the selected 100%-vmThreads median (569s); Cloudflare startup took 11s after coverage. Example time was an unrelated 156s outlier.","rollback_reason":"No primary improvement in the first sample; total time regressed due example/startup runner noise.","next_action_hint":"Repeat once because coverage stayed near the selected median and the resource-lifetime reduction is logically sound."}}
{"run":35,"commit":"97a5642","metric":0,"metrics":{"packages_coverage_seconds":577,"examples_seconds":113,"startup_seconds":65,"ci_run_id":32510354529},"status":"crash","description":"Repeat deferred Cloudflare startup under four VM workers","timestamp":1787343003909,"segment":0,"confidence":8.794117647058824,"asi":{"hypothesis":"A second deferred-container sample would isolate whether removing idle Postgres competition helps coverage.","result":"All 1,165 files and 15,375 tests passed, but the coverage step failed on the known language-server teardown race: an unhandled `Connection is disposed` rejection after the final pull-diagnostics test. Coverage execution was 576.75s.","error_details":"This is the second occurrence across different pool configurations, so it is a benchmark-independent test harness teardown defect rather than evidence against deferred Cloudflare startup.","rollback_reason":"Any CI failure is unacceptable; no performance result can be kept from this run.","next_action_hint":"Add a graceful harness shutdown path that awaits an LSP ShutdownRequest before disposal, while retaining immediate dispose for tests that deliberately settle work after teardown."}}
{"run":36,"commit":"f4a6266","metric":792,"metrics":{"packages_coverage_seconds":597,"examples_seconds":116,"startup_seconds":64,"ci_run_id":32524070966},"status":"keep","description":"Drain language-server JSON-RPC before test harness disposal","timestamp":1787346235078,"segment":0,"confidence":8.666666666666666,"asi":{"hypothesis":"Awaiting the standard LSP ShutdownRequest before routine harness disposal will drain queued JSON-RPC writes and eliminate the intermittent post-test `Connection is disposed` rejection.","result":"The complete CI Test job passed in 792s after the fix; the language-server package also passed locally with 261 tests. No unhandled rejection occurred.","correctness":"Immediate `dispose()` remains available for tests that deliberately settle a load after teardown; normal afterEach uses the new graceful `shutdown()`. A regression test covers shutdown after pull diagnostics.","scope_note":"This stabilizes the test harness rather than weakening Vitest unhandled-error handling or retrying failed tests.","next_action_hint":"Repeat the exact configuration to verify the teardown race stays absent; then decide whether deferred Cloudflare startup has value."}}
{"run":37,"commit":"64d2307","metric":761,"metrics":{"packages_coverage_seconds":582,"examples_seconds":116,"startup_seconds":49,"ci_run_id":32526728495},"status":"keep","description":"Repeat graceful LSP teardown with four VM workers","timestamp":1787347957699,"segment":0,"confidence":9.64516129032258,"asi":{"hypothesis":"The teardown fix and selected VM-thread configuration would pass repeatedly.","result":"The second post-fix job passed in 761s, with coverage at 582s. Both post-fix runs completed without the formerly intermittent language-server unhandled rejection.","stability":"Across the broader 100%-vmThreads set, five successful timing samples now cluster around a 761s upper median; the single teardown failure has a targeted fix and two subsequent clean runs.","next_action_hint":"Run a third post-fix sample for confidence, then A/B deferred Cloudflare startup by moving it back while retaining VM threads and graceful teardown."}}
{"run":38,"commit":"aef253d","metric":0,"metrics":{"packages_coverage_seconds":0,"examples_seconds":0,"startup_seconds":0,"ci_run_id":0},"status":"crash","description":"Third post-fix stability sample blocked by SSH transport","timestamp":1787348901289,"segment":0,"confidence":9.64516129032258,"asi":{"hypothesis":"A third post-fix hosted run would provide final teardown stability confidence.","result":"No CI run started. The measurement commit succeeded locally, but `git push` failed immediately because github.com closed the SSH connection.","error_details":"`fatal: the remote end hung up upon initial contact`; this is external transport failure, not candidate behavior.","rollback_reason":"No hosted benchmark exists for this iteration.","next_action_hint":"Retry the unchanged configuration; the next measure commit will include and push the local unpushed commit."}}
{"run":39,"commit":"720976a","metric":772,"metrics":{"packages_coverage_seconds":580,"examples_seconds":116,"startup_seconds":60,"ci_run_id":32530231871},"status":"discard","description":"Third post-fix graceful-teardown stability run","timestamp":1787349852614,"segment":0,"confidence":9.966666666666667,"asi":{"hypothesis":"The third actual post-fix job would remain free of language-server teardown failures.","result":"The job passed in 772s with coverage at 580s. Three post-fix jobs (792/761/772) all passed, establishing the graceful shutdown fix as stable under four VM workers.","rollback_reason":"The 772s point is 11s slower than the retained post-fix minimum; no code delta exists.","next_action_hint":"A/B Cloudflare startup position now that pool and teardown are stable."}}
{"run":40,"commit":"bc77d51","metric":0,"metrics":{"packages_coverage_seconds":0,"examples_seconds":0,"startup_seconds":0,"ci_run_id":0},"status":"crash","description":"Cloudflare startup A/B blocked by GitHub API timeout","timestamp":1787351040831,"segment":0,"confidence":9.966666666666667,"asi":{"hypothesis":"Restoring Cloudflare startup to its original position would test whether deferral changes performance.","result":"The branch pushed and CI likely triggered, but measure.sh failed while listing workflows due a GitHub API TLS handshake timeout before discovering the run.","error_details":"`couldn't fetch workflows ... net/http: TLS handshake timeout`","rollback_reason":"No benchmark result was acquired in the experiment cycle.","next_action_hint":"Retry run discovery API failures in measure.sh and recover or rerun the exact SHA."}}
{"run":41,"commit":"90a9c77","metric":0,"metrics":{"packages_coverage_seconds":0,"examples_seconds":0,"startup_seconds":0,"ci_run_id":0},"status":"crash","description":"Cloudflare startup A/B retry blocked by SSH disconnect","timestamp":1787354953888,"segment":0,"confidence":9.966666666666667,"asi":{"hypothesis":"Retry the original Cloudflare startup ordering benchmark after hardening API discovery.","result":"No hosted run started because the SSH push connection was closed by GitHub after a long network stall.","error_details":"`fatal: Could not read from remote repository` after 2015s wall time.","rollback_reason":"External transport failure produced no metric.","next_action_hint":"Retry push/measurement when GitHub SSH recovers; consider adding bounded push retries/timeouts to the harness."}}
{"run":42,"commit":"08dfbbb","metric":776,"metrics":{"packages_coverage_seconds":590,"examples_seconds":115,"startup_seconds":66,"ci_run_id":32538912290},"status":"discard","description":"Restore original Cloudflare Postgres startup ordering","timestamp":1787357778143,"segment":0,"confidence":10.310344827586206,"asi":{"hypothesis":"Starting Cloudflare Postgres before coverage would A/B whether deferral affected the critical path.","result":"The job passed in 776s with coverage at 590s. This is effectively tied with deferred-start post-fix samples (median 772s); moving an idle container did not produce a measurable benefit.","rollback_reason":"The point did not improve the retained 761s result.","decision":"Keep the original workflow ordering to minimize the final product diff; the optimization is entirely in Vitest pooling/concurrency, plus the teardown stabilization it required.","next_action_hint":"Update session notes, then test another independent Vitest setting or prepare the selected minimal diff."}}
{"run":43,"commit":"9377379","metric":763,"metrics":{"packages_coverage_seconds":590,"examples_seconds":112,"startup_seconds":57,"ci_run_id":32543138090},"status":"keep","description":"Use vmThreads default concurrency without a redundant 100% cap","timestamp":1787362543034,"segment":0,"confidence":11.074074074074074,"asi":{"hypothesis":"Vitest's default worker count equals 100% of available CPUs, so removing the explicit cap should preserve performance with a smaller, clearer config change.","result":"The job passed in 763s, effectively equal to the 761s retained run. Coverage took 590s, within the selected pool's normal range.","simplicity":"The final config now changes only the CI pool. The comment accurately explains VM per-file isolation and package-level overrides instead of claiming 100% is a cap.","next_action_hint":"Try VM pool memory recycling only if logs show growth; otherwise the minimal one-line pool change is the strongest final candidate."}}
{"run":44,"commit":"8d9d788","metric":704,"metrics":{"packages_coverage_seconds":478,"examples_seconds":155,"startup_seconds":66,"ci_run_id":32546815915},"status":"keep","description":"Restore all-core VM-thread concurrency after teardown stabilization","timestamp":1787367293787,"segment":0,"confidence":9.966666666666667,"asi":{"hypothesis":"Explicit 100% worker concurrency should outperform Vitest's default CPU-minus-one policy now that VM isolation and graceful teardown are stable.","result":"The job passed in 704s, the fastest safe serial-workload result. Package coverage fell to 478s; examples were a slower 155s, so the primary improvement came entirely from package execution.","variance_note":"478s coverage is unusually favorable relative to prior 100%-vmThreads samples (568-597s), so use the established median evidence—not this minimum alone—to justify all-core concurrency.","decision":"Retain explicit 100%: three pre-fix all-core VM jobs had a 752s median, and the post-fix all-core runs remain clean; CPU-minus-one was 763s in its sample.","next_action_hint":"Update the experiment prompt with the selected result, then inspect the final diff and run repository correctness checks."}}
{"run":45,"commit":"6bac16a","metric":797,"metrics":{"packages_coverage_seconds":600,"examples_seconds":117,"startup_seconds":72,"ci_run_id":32550544989},"status":"discard","description":"Prebundle SSR dependencies for package tests","timestamp":1787372294147,"segment":0,"confidence":11.074074074074074,"asi":{"hypothesis":"Vite SSR dependency optimization could reduce the 42-43% import share by prebundling repeatedly imported dependencies.","result":"The job passed but took 797s; coverage was 600s, slower than the selected VM-thread distribution. Cold prebundle work did not pay back in one CI run.","rollback_reason":"Primary metric regressed 93s versus the latest selected run and ~45s versus the all-core VM median.","next_action_hint":"Remove dependency optimization. Consider import-graph changes only with per-module diagnostics, not global cold prebundling."}}
{"run":46,"commit":"bbadb42","metric":728,"metrics":{"packages_coverage_seconds":552,"examples_seconds":110,"startup_seconds":62,"ci_run_id":32553470674},"status":"discard","description":"Collect Vitest import-duration diagnostics","timestamp":1787377552098,"segment":0,"confidence":9.966666666666667,"asi":{"hypothesis":"Import-duration instrumentation would identify a small set of module-graph hotspots behind the 42% import share.","result":"The job passed in 728s, but no per-import breakdown appeared for the root multi-project package run, so the instrumentation yielded no actionable hotspot data. The fast timing is consistent with runner variance.","rollback_reason":"Instrumentation adds config/output complexity without producing its intended diagnostic and does not beat the 704s selected minimum.","next_action_hint":"Remove importDurations. Avoid broad import optimization without actionable module-level evidence."}}
