{"run":47,"commit":"8f085fb","metric":616,"metrics":{"packages_coverage_seconds":445,"examples_seconds":105,"startup_seconds":62,"ci_run_id":32555459998},"status":"keep","description":"Run five VM-isolated workers on the four-core CI runner","timestamp":1787378922265,"segment":0,"confidence":9.966666666666667,"asi":{"hypothesis":"One oversubscribed VM worker can hide database/import waits in a workload split roughly evenly between test execution and imports.","result":"The job passed in 616s, 88s faster than the prior safe minimum. Coverage took 445s and examples 105s; no database, memory, or teardown failure occurred.","risk":"A fixed worker count of five assumes current runner capacity and oversubscription may reintroduce resource flakes. The first point may also be a favorable runner outlier.","next_action_hint":"Repeat maxWorkers=5 at least twice before retaining; reject on any resource instability."}}
{"run":48,"commit":"912d02d","metric":732,"metrics":{"packages_coverage_seconds":557,"examples_seconds":111,"startup_seconds":58,"ci_run_id":32557576559},"status":"discard","description":"Second five-worker VM isolation run","timestamp":1787382506588,"segment":0,"confidence":9.966666666666667,"asi":{"hypothesis":"Five workers would repeat the large all-core-plus-one throughput gain.","result":"The second run passed in 732s with coverage at 557s. It did not reproduce the 616s outlier, but remains about 20s below the four-worker median.","rollback_reason":"The 732s point regressed from the retained 616s minimum; no code delta exists.","next_action_hint":"Collect a third five-worker sample to compare medians and resource stability against four workers."}}
{"run":49,"commit":"13d0160","metric":0,"metrics":{"packages_coverage_seconds":584,"examples_seconds":112,"startup_seconds":68,"ci_run_id":32558829664},"status":"crash","description":"Third five-worker VM isolation stability run","timestamp":1787384097665,"segment":0,"confidence":9.966666666666667,"asi":{"hypothesis":"A third five-worker run would establish oversubscription stability.","result":"The run failed: adapter-postgres `rls-migration-plan.integration.test.ts` timed out at its intentional 200ms limit despite being offline. 1,164 other files passed.","error_details":"The package phase ran about 584s before failure. Five concurrent workers can starve a fast test's event loop enough to violate tight correctness timeouts.","rollback_reason":"Oversubscribing beyond runner cores introduces unacceptable timing flakes; reject maxWorkers=5 despite its faster successful runs.","next_action_hint":"Restore maxWorkers='100%' (four cores). Do not raise test timeouts to accommodate an optimization-induced resource flake."}}
{"run":50,"commit":"d1c5cf6","metric":609,"metrics":{"packages_coverage_seconds":416,"examples_seconds":117,"startup_seconds":70,"ci_run_id":32561989841},"status":"keep","description":"List the serialized Supabase project first in Vitest projects","timestamp":1787389682193,"segment":0,"confidence":9.492063492063492,"asi":{"hypothesis":"Putting the one-worker Supabase suite first might overlap its serialized work with the rest of the project graph and eliminate its ~60s tail.","result":"The job passed in 609s with coverage at 416s, but log timestamps show Supabase still began near the end (08:27:48) and finished at 08:28:33 before the 08:28:37 summary. The configured project order did not alter scheduling.","variance_note":"The fast result is favorable runner variance, not evidence for the ordering change; adapter-postgres began six minutes before Supabase exactly as before.","next_action_hint":"Repeat once to confirm, then remove the redundant explicit project path unless ordering changes in the second log."}}
{"run":51,"commit":"5991d51","metric":775,"metrics":{"packages_coverage_seconds":585,"examples_seconds":114,"startup_seconds":68,"ci_run_id":32567703419},"status":"discard","description":"Let Supabase inherit VM threads while prioritizing its project","timestamp":1787396361780,"segment":0,"confidence":9.966666666666667,"asi":{"hypothesis":"Moving Supabase into the common VM pool plus listing it first might start its one-worker suite early and remove its serialized tail.","result":"The suite passed, proving vmThreads compatibility in this run, but Supabase still started last (10:41:08 versus adapter-postgres at 10:32:33) and coverage took 585s. Neither project order nor pool unification changed scheduling.","rollback_reason":"Primary metric regressed 166s from the favorable prior point and the changes remove a documented Supabase safety override without benefit.","next_action_hint":"Restore the single project glob and Supabase `pool: 'forks'`. The Supabase tail appears intrinsic to Vitest scheduling and is not worth custom sequencing complexity."}}
{"run":52,"commit":"6573cf6","metric":770,"metrics":{"packages_coverage_seconds":588,"examples_seconds":114,"startup_seconds":62,"ci_run_id":32573118090},"status":"keep","description":"Restore minimal selected pool configuration after scheduling experiments","timestamp":1787405080228,"segment":0,"confidence":9.966666666666667,"asi":{"hypothesis":"Returning to the single project glob and Supabase's forks override would preserve the proven VM-thread speedup with the intended safety boundaries.","result":"The exact final candidate passed in 770s, 77s (9.1%) below baseline. Coverage took 588s; examples took 114s.","correctness":"Supabase again uses its documented single fork, project discovery is unchanged, all-core vmThreads remains the only root execution optimization, and graceful LSP teardown remains active.","decision":"This is the minimal final product shape. Discard further scheduler/oversubscription ideas unless new evidence appears."}}
{"run":53,"commit":"a91676f","metric":764,"metrics":{"packages_coverage_seconds":583,"examples_seconds":113,"startup_seconds":62,"ci_run_id":32577334208},"status":"discard","description":"Use plain isolated worker threads on all CI cores","timestamp":1787408351854,"segment":0,"confidence":10.678571428571429,"asi":{"hypothesis":"Plain threads might match VM-thread throughput while avoiding cross-realm semantics, at the cost of creating a fresh thread worker per isolated file.","result":"The job passed in 764s, effectively tied with the exact vmThreads final run at 770s. Coverage was 583s.","rollback_reason":"One tied sample does not outweigh vmThreads' three-sample stable evidence or demonstrate an improvement.","next_action_hint":"Repeat plain threads once; prefer threads if it remains tied and stability is equal because semantics are closer to the original fork pool."}}
{"run":54,"commit":"9b9a36a","metric":0,"metrics":{"packages_coverage_seconds":0,"examples_seconds":0,"startup_seconds":0,"ci_run_id":0},"status":"crash","description":"Plain-thread repeat blocked by GitHub API connectivity","timestamp":1787410632292,"segment":0,"confidence":10.678571428571429,"asi":{"hypothesis":"A second plain-thread run would compare stability and median against vmThreads.","result":"The commit pushed, but measure.sh failed before run discovery when api.github.com was unreachable.","error_details":"`error connecting to api.github.com`; no candidate result acquired in this cycle.","rollback_reason":"External measurement-harness failure.","next_action_hint":"Retry unchanged; harden PR lookup API retries if connectivity failures persist."}}
{"run":55,"commit":"e82363b","metric":667,"metrics":{"packages_coverage_seconds":477,"examples_seconds":107,"startup_seconds":76,"ci_run_id":32581732238},"status":"keep","description":"Second successful all-core plain-thread run","timestamp":1787413350618,"segment":0,"confidence":10.310344827586206,"asi":{"hypothesis":"Plain threads would repeat safely and might avoid VM-context overhead while retaining per-file isolation.","result":"The job passed in 667s with coverage at 477s. Two successful samples are 764s and 667s (median 715.5s), competitive with or better than vmThreads while using conventional thread isolation.","variance_note":"The 477s coverage phase is favorable and close to the best vmThreads outlier, so a third sample is required.","next_action_hint":"Collect a third plain-thread sample; prefer it over vmThreads only if stability remains clean and the median stays lower."}}
{"run":56,"commit":"96ac20f","metric":797,"metrics":{"packages_coverage_seconds":606,"examples_seconds":117,"startup_seconds":68,"ci_run_id":32583320784},"status":"discard","description":"Third all-core plain-thread sample","timestamp":1787417021696,"segment":0,"confidence":10.678571428571429,"asi":{"hypothesis":"A third plain-thread sample would establish a competitive median.","result":"The run passed in 797s with coverage at 606s. Three samples are 667/764/797 (median 764s), versus the initial vmThreads median of 752s and a broader set of clean vm results.","rollback_reason":"Plain threads are ~12s slower by three-sample median and show wider variance, so they do not improve the selected VM pool.","next_action_hint":"Restore vmThreads and retain the exact minimal candidate."}}
{"run":57,"commit":"5cbc844","metric":782,"metrics":{"packages_coverage_seconds":593,"examples_seconds":117,"startup_seconds":66,"ci_run_id":32587178883},"status":"keep","description":"Restore selected all-core VM-thread pool after plain-thread A/B","timestamp":1787420686336,"segment":0,"confidence":10.872727272727273,"asi":{"hypothesis":"Returning to vmThreads would preserve the selected semantic isolation and performance profile.","result":"The exact final candidate passed again in 782s, 65s below baseline. Coverage took 593s. This adds another clean all-core VM run after the teardown fix.","decision":"Keep vmThreads: its controlled three-sample comparison beat plain threads by median, and the final diff remains limited to root pool/concurrency plus graceful test teardown."}}
{"run":58,"commit":"9960613","metric":749,"metrics":{"packages_coverage_seconds":565,"examples_seconds":115,"startup_seconds":63,"ci_run_id":32591693433},"status":"keep","description":"Additional exact-final VM-thread stability sample","timestamp":1787426269809,"segment":0,"confidence":11.074074074074074,"asi":{"hypothesis":"Another unchanged final-candidate run would strengthen the hosted median and stability evidence.","result":"The job passed in 749s with coverage at 565s. The exact final shape continues to pass and stays materially below the 847s baseline.","distribution":"Excluding deliberately altered pools and unsafe overlap, all-core vmThreads has repeated successful results across favorable and ordinary runners, with no post-fix teardown failures."}}
{"run":59,"commit":"8f66a6a","metric":0,"metrics":{"packages_coverage_seconds":0,"examples_seconds":0,"startup_seconds":0,"ci_run_id":32594808943},"status":"crash","description":"Enable Node compile cache for the Test job","timestamp":1787434379569,"segment":0,"confidence":11.074074074074074,"asi":{"hypothesis":"A job-local Node compile cache could reuse compiled module code across isolated workers and reduce import cost.","result":"The CI workflow was rejected before jobs were created. GitHub recorded a zero-job `CI (PR)` push failure and emitted no pull_request run.","error_details":"The candidate used `${{ runner.temp }}` in job-level env, where the `runner` context is unavailable during workflow validation.","rollback_reason":"Invalid workflow; no benchmark ran.","next_action_hint":"Use a fixed fresh-runner path such as `/tmp/prisma-next-node-compile-cache`, update the workflow contract test, and rerun."}}
